{
  "aicpm_version": "0.1",
  "created_at": "2026-01-16T00:00:00Z",
  "providers": [],
  "chunks": [
    {
      "id": "44444444-4444-4444-4444-444444444444",
      "provider_id": "unknown.ai",
      "model_id": "example-model",
      "session_id": "session-4",
      "timestamp": "2026-01-16T00:00:04Z",
      "chunk_hash_b64u": "BBBBBBBBBBBBBBBBBBBBBBBBBBBBBBBBBBBBBBBBBBB",
      "key_id": "missing-key",
      "sig_b64u": "CCCCCCCCCCCCCCCCCCCCCCCCCCCCCCCCCCCCCCCCCCC",
      "text_len": 25
    }
  ]
}
