{
  "aicpm_version": "0.1",
  "created_at": "2026-01-16T00:00:00Z",
  "providers": [
    {
      "provider_id": "example.ai",
      "key_id": "test-key-1",
      "alg": "ed25519",
      "public_key_b64u": "AAAAAAAAAAAAAAAAAAAAAAAAAAAAAAAAAAAAAAAAAAA"
    }
  ],
  "chunks": [
    {
      "id": "22222222-2222-2222-2222-222222222222",
      "provider_id": "example.ai",
      "model_id": "example-model",
      "session_id": "session-2",
      "timestamp": "2026-01-16T00:00:02Z",
      "chunk_hash_b64u": "BBBBBBBBBBBBBBBBBBBBBBBBBBBBBBBBBBBBBBBBBBB",
      "key_id": "test-key-1",
      "sig_b64u": "CCCCCCCCCCCCCCCCCCCCCCCCCCCCCCCCCCCCCCCCCCC",
      "text_len": 50
    }
  ]
}
